{
  "id": "8819a1f9-09bf-48d7-9da0-214127852ab3",
  "name": "Stable Diffusion WebUI Forge",
  "description": "**Stable Diffusion WebUI Forge** (lllyasviel) \u2014 a performance-focused fork of the original A1111 WebUI: same extension ecosystem and UI, with better memory management and faster inference, especially on lower-VRAM cards.",
  "version": 1,
  "subVersion": 0,
  "isReleaseConfig": true,
  "isLegacy": false,
  "workloadTarget": "Installer",
  "workflowType": "Image",
  "thumbnail": "thumbnail.webp",
  "repository": {
    "type": "Forge",
    "repositoryUrl": "https://github.com/lllyasviel/stable-diffusion-webui-forge",
    "branch": "",
    "commitHash": ""
  },
  "python": {
    "pythonVersion": "3.10",
    "interpreterPathOverride": "",
    "pythonSource": "Auto",
    "minimumPatchVersion": "",
    "createVirtualEnvironment": true,
    "createVramSettings": false,
    "virtualEnvironmentName": "venv",
    "installTriton": false,
    "installSageAttention": false
  },
  "torch": {
    "torchVersion": "2.8.0",
    "cudaVersion": "12.8",
    "indexUrl": ""
  },
  "paths": {
    "rootDirectory": "",
    "defaultModelDownloadDirectory": "",
    "logFileName": "install.log",
    "defaultDiffusionModelFolder": "",
    "defaultLoraFolder": "",
    "defaultVAEFolder": "",
    "defaultCheckpointFolder": "",
    "defaultEmbeddingFolder": "",
    "defaultUpscalerFolder": "",
    "defaultControlNetFolder": "",
    "defaultTextEncoderFolder": "",
    "defaultClipFolder": "",
    "defaultClipVisionFolder": "",
    "coreModelsDirectory": ""
  },
  "vram": {
    "vramProfiles": ""
  },
  "installLamaCpp": false,
  "selectedLamaCppWheelId": null,
  "gitRepositories": [],
  "modelDownloads": []
}
