{
  "id": "a229c02e-2586-47df-8be2-b342defc78ec",
  "name": "MiniMax H3",
  "description": "MiniMax H3 is a general-purpose, omni-modal generative system. It supports unified understanding of multimodal contexts composed of text, images, video, and audio, and can generate video with native stereo audio at resolutions up to 2K and durations of up to 15 seconds. Thanks to its task-generalization-oriented system design, H3 already possesses broad multimodal context understanding and generation capabilities at the pre-training stage, enabling outstanding performance in following complex multimodal instructions.",
  "version": 1,
  "subVersion": 7,
  "isReleaseConfig": true,
  "isLegacy": false,
  "workloadTarget": "Installer",
  "workflowType": "Video",
  "thumbnail": "thumbnail.webp",
  "repository": {
    "type": "ComfyUI",
    "repositoryUrl": "https://github.com/comfyanonymous/ComfyUI",
    "branch": "",
    "commitHash": ""
  },
  "python": {
    "pythonVersion": "3.12",
    "interpreterPathOverride": "",
    "pythonSource": "Auto",
    "minimumPatchVersion": "",
    "createVirtualEnvironment": true,
    "createVramSettings": true,
    "virtualEnvironmentName": "venv",
    "installTriton": true,
    "installSageAttention": true
  },
  "torch": {
    "torchVersion": "2.11.0",
    "cudaVersion": "13.0",
    "indexUrl": ""
  },
  "paths": {
    "rootDirectory": "",
    "defaultModelDownloadDirectory": "",
    "logFileName": "install.log",
    "defaultDiffusionModelFolder": "",
    "defaultLoraFolder": "",
    "defaultVAEFolder": "",
    "defaultCheckpointFolder": "",
    "defaultEmbeddingFolder": "",
    "defaultUpscalerFolder": "",
    "defaultControlNetFolder": "",
    "defaultTextEncoderFolder": "",
    "defaultClipFolder": "",
    "defaultClipVisionFolder": "",
    "coreModelsDirectory": ""
  },
  "vram": {
    "vramProfiles": "12,16,24,32"
  },
  "installLamaCpp": false,
  "selectedLamaCppWheelId": null,
  "gitRepositories": [
    "95a15b05-9b3d-4a37-8636-9f09513cfad4",
    "da9fb948-c137-458e-8aac-96f7fe18e200",
    "2043617d-7613-4138-a1d1-8f0d5814a439",
    "b6fd8a6e-ccbb-4a5c-a9df-912d0407e4aa",
    "b3e6754c-a5cc-42a9-8943-cd5fe7581b2f",
    "8a662629-0eeb-41a1-8c28-1916e08e20b9",
    "bb68fb22-52c1-428f-93a3-106e44d8fcf8",
    "22c44679-20c2-4320-bfe7-dc1c9cd66f31",
    "4b770405-17dc-48a8-8572-86edb36cbe41",
    "1f4b6839-7563-4fa2-abe1-62673530d3ed"
  ],
  "modelDownloads": [
    {
      "id": "1b80545c-b469-438c-a208-bc28f8595847",
      "name": "MiniMax-H3-Ref2VA-Pruned-GGUF",
      "downloadLinks": [
        {
          "id": "597413d9-1f95-4086-8a07-c06888d31c2b",
          "url": "https://huggingface.co/Abiray/MiniMax-H3-Pruned-GGUF/resolve/main/MiniMax-H3-Ref2VA-Pruned-Q8_0.gguf?download=true",
          "vramProfile": "VRAM_32GB",
          "destination": "",
          "enabled": true
        },
        {
          "id": "9278e70f-0bbb-4411-9b8d-76aa2d6365e1",
          "url": "https://huggingface.co/Abiray/MiniMax-H3-Pruned-GGUF/resolve/main/MiniMax-H3-Ref2VA-Pruned-Q6_K.gguf?download=true",
          "vramProfile": "VRAM_24GB",
          "destination": "",
          "enabled": true
        },
        {
          "id": "64b9c3ea-8b75-432c-9d4d-d16556c3077c",
          "url": "https://huggingface.co/Abiray/MiniMax-H3-Pruned-GGUF/resolve/main/MiniMax-H3-Ref2VA-Pruned-Q4_K_M.gguf?download=true",
          "vramProfile": "VRAM_16GB",
          "destination": "",
          "enabled": true
        },
        {
          "id": "24cac632-1dff-44ae-9b77-9ce1e9651071",
          "url": "https://huggingface.co/Abiray/MiniMax-H3-Pruned-GGUF/resolve/main/MiniMax-H3-Ref2VA-Pruned-Q3_K_M.gguf?download=true",
          "vramProfile": "VRAM_12GB",
          "destination": "",
          "enabled": true
        }
      ],
      "url": "",
      "destination": "models/diffusion_models",
      "vramProfile": "VRAM_16GB",
      "enabled": true,
      "isPlaceholder": false
    },
    {
      "id": "74d0450c-7aba-41b5-8cf6-4e4dfb8d0b95",
      "name": "qwen3vl_32b_minimax_h3_nvfp4_awq",
      "downloadLinks": [
        {
          "id": "970f3d59-6ea7-4f47-8e1d-fb64e7d73d96",
          "url": "https://huggingface.co/Comfy-Org/MiniMax-H3/resolve/main/text_encoders/qwen3vl_32b_minimax_h3_nvfp4_awq.safetensors",
          "vramProfile": null,
          "destination": "",
          "enabled": true
        }
      ],
      "url": "",
      "destination": "models/text_encoders",
      "vramProfile": "VRAM_16GB",
      "enabled": true,
      "isPlaceholder": false
    },
    {
      "id": "be133d3e-c586-4486-b391-dcb210d67a1a",
      "name": "Minimax-h3-Turbo-8-Step",
      "downloadLinks": [
        {
          "id": "1830b103-9fc6-4e54-a6a5-3f05bb7d17d4",
          "url": "https://huggingface.co/lightx2v/Minimax-h3-Turbo/resolve/main/minimax_h3_fl2v_turbo_8step_v1.0_comfyui_bf16.safetensors",
          "vramProfile": null,
          "destination": "",
          "enabled": true
        }
      ],
      "url": "",
      "destination": "models/loras",
      "vramProfile": "VRAM_16GB",
      "enabled": true,
      "isPlaceholder": false
    },
    {
      "id": "f09be87a-f65d-4364-9872-2b298934f357",
      "name": "minimax_h3_video_vae_fp16",
      "downloadLinks": [
        {
          "id": "cdf5ee22-d64d-4145-9f92-27b4aa234329",
          "url": "https://huggingface.co/Comfy-Org/MiniMax-H3/resolve/main/vae/minimax_h3_video_vae_fp16.safetensors",
          "vramProfile": null,
          "destination": "",
          "enabled": true
        }
      ],
      "url": "",
      "destination": "models/vae",
      "vramProfile": "VRAM_16GB",
      "enabled": true,
      "isPlaceholder": false
    },
    {
      "id": "f33da443-0140-435c-91e8-422dcf55b5a9",
      "name": "MiniMax-H3-FL2VA-Pruned-GGUF",
      "downloadLinks": [
        {
          "id": "c223280d-7806-4537-8505-f8dcd8478942",
          "url": "https://huggingface.co/Abiray/MiniMax-H3-Pruned-GGUF/resolve/main/MiniMax-H3-FL2VA-Pruned-Q8_0.gguf?download=true",
          "vramProfile": "VRAM_32GB",
          "destination": "",
          "enabled": true
        },
        {
          "id": "41347948-c404-4640-a6ec-4073ed89e4ae",
          "url": "https://huggingface.co/Abiray/MiniMax-H3-Pruned-GGUF/resolve/main/MiniMax-H3-FL2VA-Pruned-Q6_K.gguf?download=true",
          "vramProfile": "VRAM_24GB",
          "destination": "",
          "enabled": true
        },
        {
          "id": "eea4b13c-bd70-4b8a-b1f3-2fcc17804783",
          "url": "https://huggingface.co/Abiray/MiniMax-H3-Pruned-GGUF/resolve/main/MiniMax-H3-FL2VA-Pruned-Q5_K_M.gguf?download=true",
          "vramProfile": "VRAM_16GB",
          "destination": "",
          "enabled": true
        },
        {
          "id": "d55908d3-82ee-4f0f-af40-6bb58ca35349",
          "url": "https://huggingface.co/Abiray/MiniMax-H3-Pruned-GGUF/resolve/main/MiniMax-H3-FL2VA-Pruned-Q3_K_M.gguf?download=true",
          "vramProfile": "VRAM_12GB",
          "destination": "",
          "enabled": true
        }
      ],
      "url": "",
      "destination": "models/diffusion_models",
      "vramProfile": "VRAM_16GB",
      "enabled": true,
      "isPlaceholder": false
    },
    {
      "id": "f613bae7-ac61-480a-9e88-70dabc76b633",
      "name": "minimax_h3_audio_vae_fp32",
      "downloadLinks": [
        {
          "id": "ffdd6267-05a1-455e-9261-e63a09e64c29",
          "url": "https://huggingface.co/Comfy-Org/MiniMax-H3/resolve/main/vae/minimax_h3_audio_vae_fp32.safetensors",
          "vramProfile": null,
          "destination": "",
          "enabled": true
        }
      ],
      "url": "",
      "destination": "models/vae",
      "vramProfile": "VRAM_16GB",
      "enabled": true,
      "isPlaceholder": false
    }
  ]
}
